{
  "schemaVersion": "1.0",
  "modelVersion": "1.0.0",
  "seed": 42,
  "workers": 1,
  "queueCapacity": 2,
  "attemptTimeoutMs": 50,
  "overallTimeoutMs": 200,
  "maxAttempts": 3,
  "backoff": "EXPONENTIAL",
  "baseDelayMs": 40,
  "maxDelayMs": 80,
  "jitter": "NONE",
  "retryBudget": 48,
  "unavailableUntilMs": 60,
  "requests": [{ "id": "a", "arrivalTimeMs": 0, "serviceTimeMs": 20 }]
}
